message,message_length,punct%
"SMS SERVICES. for your inclusive text credits, pls goto www.comuk.net login= 3qxj9 unsubscribe with STOP, no extra charge. help 08702840625.COMUK. 220-CM2 9AE",137,7.3
Will it help if we propose going back again tomorrow,43,0.0
"FREE GAME. Get Rayman Golf 4 FREE from the O2 Games Arcade. 1st get UR games settings. Reply POST, then save & activ8. Press 0 key for Arcade. Termsapply",125,5.6000000000000005
He telling not to tell any one. If so treat for me hi hi hi,45,2.1999999999999997
Give one miss from that number please,31,0.0
You are awarded a SiPix Digital Camera! call 09061221061 from landline. Delivery within 28days. T Cs Box177. M221BP. 2yr warranty. 150ppm. 16 . p p£3.99,128,7.000000000000001
Tell me pa. How is pain de.,21,9.5
"Den only weekdays got special price... Haiz... Cant eat liao... Cut nails oso muz wait until i finish drivin wat, lunch still muz eat wat... ",116,11.200000000000001
Left dessert. U wan me 2 go suntec look 4 u?,34,5.8999999999999995
Aight sorry I take ten years to shower. What's the plan?,46,6.5
So u wan 2 come for our dinner tonight a not?,35,2.9000000000000004
Then ü come n pick me at 530 ar?,24,4.2
Ü dun need to pick ur gf?,19,5.3
Love has one law; Make happy the person you love. In the same way friendship has one law; Never make ur friend feel alone until you are alive.... Gud night,126,5.6000000000000005
I'm done...,10,40.0
Becoz its  &lt;#&gt;  jan whn al the post ofice is in holiday so she cn go fr the post ofice...got it duffer,85,9.4
"Ola would get back to you maybe not today but I ve told him you can be his direct link in the US in getting cars he bids for online, you arrange shipping and you get a cut. Or U????? For a partnership where U????? Invest money for shipping and he takes care of the rest!U??Wud b self reliant soon dnt worry",245,6.1
"aight we can pick some up, you open before tonight?",42,4.8
And is there a way you can send shade's stuff to her. And she has been wonderful too.,68,4.3999999999999995
Miserable. They don't tell u that the side effects of birth control are massive gut wrenching cramps for the first 2 months. I didn't sleep at all last night.,130,3.8
"Oops I did have it,  &lt;#&gt; ?",25,28.000000000000004
Pls she needs to dat slowly or she will vomit more.,41,2.4
That's necessarily respectful,27,3.6999999999999997
"You have won ?1,000 cash or a ?2,000 prize! To claim, call09050000327",58,10.299999999999999
Bring home some Wendy =D,20,5.0
", ,  and  picking them up from various points | going 2 yeovil | and they will do the motor project 4 3 hours | and then u take them home. || 12 2 5.30 max. || Very easy",129,9.3
Jordan got voted out last nite!,26,3.8
We tried to call you re your reply to our sms for a video mobile 750 mins UNLIMITED TEXT free camcorder Reply or call now 08000930705 Del Thurs,116,0.0
Joy's father is John. Then John is the NAME of Joy's father. Mandan,55,7.3
I wish! I don't think its gonna snow that much. But it will be more than those flurries we usually get that melt before they hit the ground. Eek! We haven't had snow since &lt;#&gt; before I was even born!,166,7.199999999999999
"Sorry chikku, my cell got some problem thts y i was nt able to reply u or msg u..",63,4.8
R ü comin back for dinner?,21,4.8
What you doing?how are you?,23,8.7
Hey! do u fancy meetin me at 4 at cha  hav a lil beverage on me. if not txt or ring me and we can meet up l8r. quite tired got in at 3 v.pist ;) love Pete x x x,120,5.0
Lol yes. But it will add some spice to your day.,38,5.3
Why do you ask princess?,20,5.0
You have won a guaranteed £200 award or even £1000 cashto claim UR award call free on 08000407165 (18+) 2 stop getstop on 88222 PHP. RG21 4JX,115,3.5000000000000004
That means from february to april i'll be getting a place to stay down there so i don't have to hustle back and forth during audition season as i have since my sister moved away from harlem.,154,1.9
Was actually about to send you a reminder today. Have a wonderful weekend,61,1.6
"Congrats! 2 mobile 3G Videophones R yours. call 09063458130 now! videochat wid your mates, play java games, Dload polyPH music, noline rentl.",120,5.800000000000001
i can call in  &lt;#&gt;  min if thats ok,31,16.1
See you there! ,12,8.3
Not yet had..ya sapna aunty manege y'day hogidhe..chinnu full weak and swalpa black agidhane..,81,8.6
oh ya... Got hip hop open. Haha i was thinking can go for jazz then zoom to cine... Actually tonight i'm free leh... And there's a kb lesson tonight,120,10.0
"Daddy, shu shu is looking 4 u... U wan me 2 tell him u're not in singapore or wat?",64,9.4
What do u want when i come back?.a beautiful necklace as a token of my heart for you.thats what i will give but ONLY to MY WIFE OF MY LIKING.BE THAT AND SEE..NO ONE can give you that.dont call me.i will wait till i come.,176,5.1
"The world suffers a lot... Not because of the violence of bad people. But because of the silence of good people!, Gud night....",105,9.5
So no messages. Had food?,21,9.5
Email AlertFrom: Jeri StewartSize: 2KBSubject: Low-cost prescripiton drvgsTo listen to email call 123,89,4.5
Yo! Howz u? girls never rang after india. L,35,8.6
We still on for tonight?,20,5.0
"If you don't, your prize will go to another customer. T&C at www.t-c.biz 18+ 150p/min Polo Ltd Suite 373 London W1J 6HL Please call back if busy",118,7.6
Pls go there today  &lt;#&gt; . I dont want any excuses,44,13.600000000000001
Oh ya ya. I remember da. .,20,15.0
"Last Chance! Claim ur £150 worth of discount vouchers today! Text SHOP to 85023 now! SavaMob, offers mobile! T Cs SavaMob POBOX84, M263UZ. £3.00 Sub. 16",127,7.1
Were trying to find a Chinese food place around here,43,0.0
Free entry in 2 a weekly comp for a chance to win an ipod. Txt POD to 80182 to get entry (std txt rate) T&C's apply 08452810073 for details 18+,114,5.3
"Tick, tick, tick .... Where are you ? I could die of loneliness you know ! *pouts* *stomps feet* I need you ...",89,16.900000000000002
Boy you best get yo ass out here quick,30,0.0
No no. I will check all rooms befor activities,38,2.6
Fine am simply sitting.,20,5.0
"Sorry, I'll call later",19,10.5
"The table's occupied, I'm waiting by the tree",38,7.9
Camera - You are awarded a SiPix Digital Camera! call 09061221066 fromm landline. Delivery within 28 days.,90,4.3999999999999995
You do your studies alone without anyones help. If you cant no need to study.,63,3.2
He also knows about lunch menu only da. . I know,38,5.3
"Ok. Not much to do here though. H&M Friday, cant wait. Dunno wot the hell im gonna do for another 3 weeks! Become a slob- oh wait, already done that! ",120,7.5
Watching ajith film ah?,20,5.0
Don no da:)whats you plan?,22,13.600000000000001
Why must we sit around and wait for summer days to celebrate. Such a magical sight when the worlds dressed in white. Oooooh let there be snow.,116,2.6
UR awarded a City Break and could WIN a £200 Summer Shopping spree every WK. Txt STORE to 88039.SkilGme.TsCs087147403231Winawk!Age16+£1.50perWKsub,128,4.7
Haven't eaten all day. I'm sitting here staring at this juicy pizza and I can't eat it. These meds are ruining my life.,97,6.2
"No, I decided that only people who care about stuff vote and caring about stuff is for losers",76,1.3
Was the farm open?,15,6.7
I will reach office around  &lt;DECIMAL&gt; . &amp; my mobile have problem. You cann't get my voice. So call you asa i'll free,103,10.7
Tell where you reached,19,0.0
"Hiya, probably coming home * weekend after next",40,5.0
"TODAY is Sorry day.! If ever i was angry with you, if ever i misbehaved or hurt you? plz plz JUST SLAP URSELF Bcoz, Its ur fault, I'm basically GOOD",119,5.8999999999999995
You are a very very very very bad girl. Or lady.,38,5.3
Uncle Abbey! Happy New Year. Abiola,30,6.7
Got it! It looks scrumptious... daddy wants to eat you all night long!,58,8.6
Most of the tiime when i don't let you hug me it's so i don't break into tears.,62,6.5
SERIOUSLY. TELL HER THOSE EXACT WORDS RIGHT NOW.,41,4.9
Are you there in room.,18,5.6000000000000005
"Ooh, 4got, i'm gonna start belly dancing in moseley weds 6.30 if u want 2 join me, they have a cafe too. ",83,7.199999999999999
Aah bless! How's your arm?,22,13.600000000000001
How are you with moneY...as in to you...money aint a thing....how are you sha!,65,16.900000000000002
Mm so you asked me not to call radio,28,0.0
Should I be stalking u?,19,5.3
Ok... But they said i've got wisdom teeth hidden inside n mayb need 2 remove.,63,7.9
Jus finished avatar nigro,22,0.0
No break time one... How... I come out n get my stuff fr ü?,46,15.2
U know we watchin at lido?,21,4.8
Okay name ur price as long as its legal! Wen can I pick them up? Y u ave x ams xx,61,3.3000000000000003
How abt making some of the pics bigger?,32,3.1
A £400 XMAS REWARD IS WAITING FOR YOU! Our computer has randomly picked you from our loyal mobile customers to receive a £400 reward. Just call 09066380611 ,129,1.6
"Are you sure you don't mean ""get here, we made you hold all the weed""",55,7.3
This phone has the weirdest auto correct.,35,2.9000000000000004
Do u ever get a song stuck in your head for no reason and it won't go away til u listen to it like 5 times?,82,2.4
FREE for 1st week! No1 Nokia tone 4 ur mobile every week just txt NOKIA to 8077 Get txting and tell ur mates. www.getzed.co.uk POBox 36504 W45WQ 16+ norm150p/tone,134,5.2
Thnx dude. u guys out 2nite?,23,8.7
Its hard to believe things like this. All can say lie but think twice before saying anything to me.,81,2.5
YOU HAVE WON! As a valued Vodafone customer our computer has picked YOU to win a £150 prize. To collect is easy. Just call 09061743386 ,110,2.7
lyricalladie(21/F) is inviting you to be her friend. Reply YES-910 or NO-910. See her: www.SMS.ac/u/hmmross STOP? Send STOP FRND to 62468,117,11.1
Well boy am I glad G wasted all night at applebees for nothing,50,0.0
Our brand new mobile music service is now live. The free music player will arrive shortly. Just install on your phone to browse content from the top artists.,130,2.3
IM REALY SOZ IMAT MY MUMS 2NITE WHAT ABOUT 2MORO ,39,0.0
No problem baby. Is this is a good time to talk? I called and left a message.,61,4.9
What i told before i tell. Stupid hear after i wont tell anything to you. You dad called to my brother and spoken. Not with me.,102,3.9
What happen dear. Why you silent. I am tensed,37,5.4
I'll be late...,13,30.8
"Hey sexy buns ! Have I told you ? I adore you, loverboy. I hope you remember to thank your sister in law for those meatballs *grins* ... i love you, babe",122,8.200000000000001
Stupid.its not possible,21,4.8
"Sorry pa, i dont knw who ru pa?",24,8.3
At what time are you coming.,23,4.3
He says hi and to get your ass back to south tampa (preferably at a kegger),60,3.3000000000000003
Huh y lei...,10,30.0
"all the lastest from Stereophonics, Marley, Dizzee Racal, Libertines and The Strokes! Win Nookii games with Flirt!! Click TheMob WAP Bookmark or text WAP to 82468",137,4.3999999999999995
Sorry da:)i was thought of calling you lot of times:)lil busy.i will call you at noon..,72,9.700000000000001
Yup i'm free...,13,30.8
I have many dependents,19,0.0
"Dude u knw also telugu..thts gud..k, gud nyt..",39,17.9
Hey now am free you can call me.,25,4.0
"I do know what u mean,  is the king of not havin credit! I'm goin2bed now. Night night sweet! Only1more sleep! ",89,6.7
They finally came to fix the ceiling.,31,3.2
Oh yes I can speak txt 2 u no! Hmm. Did u get  email?,39,7.7
"A bit of Ur smile is my hppnss, a drop of Ur tear is my sorrow, a part of Ur heart is my life, a heart like mine wil care for U, forevr as my GOODFRIEND",117,3.4000000000000004
For my family happiness..,22,9.1
FREE>Ringtone! Reply REAL or POLY eg REAL1 1. PushButton 2. DontCha 3. BabyGoodbye 4. GoldDigger 5. WeBeBurnin 1st tone FREE and 6 more when u join for £3/wk,130,6.2
"Sorry, it's a lot of friend-of-a-friend stuff, I'm just now about to talk to the actual guy who wants to buy",88,8.0
Lol alright i was thinkin that too haha,32,0.0
"Dont search love, let love find U. Thats why its called falling in love, bcoz U dont force yourself, U just fall and U know there is smeone to hold U... BSLVYL",128,5.5
You have registered Sinco as Payee. Log in at icicibank.com and enter URN  &lt;#&gt;  to confirm. Beware of frauds. Do NOT share or disclose URN to anyone.,127,7.9
"Total disappointment, when I texted you was the craziest shit got :(",57,5.3
So wat's da decision?,18,11.1
Slaaaaave ! Where are you ? Must I summon you to me all the time now ? Don't you wish to come to me on your own anymore?,93,5.4
"swhrt how u dey,hope ur ok, tot about u 2day.love n miss.take care.",55,9.1
"Honeybee Said: *I'm d Sweetest in d World* God Laughed &amp; Said: *Wait,U Havnt Met d Person Reading This Msg* MORAL: Even GOD Can Crack Jokes! GM+GN+GE+GN:)",132,12.9
Have you been practising your curtsey?,33,3.0
Idk. I'm sitting here in a stop and shop parking lot right now bawling my eyes out because i feel like i'm a failure in everything. Nobody wants me and now i feel like i'm failing you.,148,4.1000000000000005
"SHIT BABE.. THASA BIT MESSED UP.YEH, SHE SHUDVETOLD U. DID URGRAN KNOW?NEWAY, ILLSPEAK 2 U2MORO WEN IM NOT ASLEEP...",98,10.2
But your brother transfered only  &lt;#&gt;  +  &lt;#&gt; . Pa.,51,25.5
Ok lor...,8,37.5
Yar i wanted 2 scold u yest but late already... I where got zhong se qing you? If u ask me b4 he ask me then i'll go out w u all lor. N u still can act so real.,121,5.800000000000001
Have you seen who's back at Holby?!,29,10.299999999999999
"pdate_Now - Double mins and 1000 txts on Orange tariffs. Latest Motorola, SonyEricsson & Nokia & Bluetooth FREE! Call MobileUpd8 on 08000839402 or call2optout/!YHL",140,6.4
S...from the training manual it show there is no tech process:)its all about password reset and troubleshooting:),97,7.199999999999999
Ur cash-balance is currently 500 pounds - to maximize ur cash-in now send CASH to 86688 only 150p/msg. CC: 08708800282 HG/Suite342/2Lands Row/W1J6HL,127,7.1
"No dice, art class 6 thru 9 :( thanks though. Any idea what time I should come tomorrow?",71,7.000000000000001
Dear are you angry i was busy dear,27,0.0
Will ü b going to esplanade fr home?,29,3.4000000000000004
"Yeah, probably but not sure. Ilol let u know, but personally I wuldnt bother, then again if ur goin to then I mite as well!!",100,6.0
I couldn't say no as he is a dying man and I feel sad for him so I will go and I just wanted you to know I would probably be gone late into your night,115,0.8999999999999999
Can i get your opinion on something first?,35,2.9000000000000004
Hi Chachi tried calling u now unable to reach u .. Pl give me a missed cal once u c tiz msg  Kanagu,76,2.6
1's finish meeting call me.,23,8.7
Havent still waitin as usual... Ü come back sch oredi?,45,8.9
My drive can only be read. I need to write,33,3.0
Small problem in auction:)punj now asking tiwary,42,4.8
Okie,4,0.0
Feel Yourself That You Are Always Happy.. Slowly It Becomes Your Habit &amp; Finally It Becomes Part Of Your Life.. Follow It.. Happy Morning &amp; Have A Happy Day:),138,8.7
Where are you?when wil you reach here?,32,6.2
SplashMobile: Choose from 1000s of gr8 tones each wk! This is a subscrition service with weekly tones costing 300p. U have one credit - kick back and ENJOY,128,3.1
"Nt only for driving even for many reasons she is called BBD..thts it chikku, then hw abt dvg cold..heard tht vinobanagar violence hw is the condition..and hw ru ? Any problem?",145,6.2
Except theres a chick with huge boobs.,32,3.1
It will stop on itself. I however suggest she stays with someone that will be able to give ors for every stool.,90,2.1999999999999997
I cant wait for cornwall. Hope tonight isnt too bad as well but its rock night shite. Anyway im going for a kip now have a good night. Speak to you soon.,126,3.2
"Update_Now - Xmas Offer! Latest Motorola, SonyEricsson & Nokia & FREE Bluetooth! Double Mins & 1000 Txt on Orange. Call MobileUpd8 on 08000839402 or call2optout/F4Q=",141,7.8
Hi. Happy New Year. I dont mean to intrude but can you pls let me know how much tuition you paid last semester and how much this semester is. Thanks,119,2.5
"Urgent -call 09066649731from Landline. Your complimentary 4* Ibiza Holiday or £10,000 cash await collection SAE T&Cs PO BOX 434 SK3 8WP 150ppm 18+",124,4.8
I know! Grumpy old people. My mom was like you better not be lying. Then again I am always the one to play jokes...,92,6.5
"Sir, I need AXIS BANK account no and bank address.",41,4.9
Wah lucky man... Then can save money... Hee...,39,23.1
I cant pick the phone right now. Pls send a message,41,2.4
"Ha ha nan yalrigu heltini..Iyo kothi chikku, u shared many things wit me..so far i didn't told any body and even uttered a word abt u.. If ur trusting me so much how can i tell these to others.. Plz nxt time dont use those words to me..ok, chikku:-);-)B-)",207,10.100000000000001
Waiting 4 my tv show 2 start lor... U leh still busy doing ur report?,55,7.3
"Hey elaine, is today's meeting still on?",34,8.799999999999999
"Awesome, be there in a minute",24,4.2
I'll let you know when it kicks in,27,3.6999999999999997
Jason says it's cool if we pick some up from his place in like an hour,55,1.7999999999999998
"Dont pack what you can buy at any store.like cereals. If you must pack food, pack gari or something 9ja that you will miss.",100,4.0
Ok im not sure what time i finish tomorrow but i wanna spend the evening with you cos that would be vewy vewy lubly! Love me xxx,102,1.0
Send a logo 2 ur lover - 2 names joined by a heart. Txt LOVE NAME1 NAME2 MOBNO eg LOVE ADAM EVE 07123456789 to 87077 Yahoo! POBox36504W45WQ TxtNO 4 no ads 150p,128,2.3
Ha ha cool cool chikku chikku:-):-DB-),33,21.2
Senthil group company Apnt 5pm.,27,3.6999999999999997
2 laptop... I noe infra but too slow lar... I wan fast one,46,13.0
Sounds like a plan! Cardiff is still here and still cold! I'm sitting on the radiator!,71,5.6000000000000005
What can i do? Might accidant tookplace between somewhere ghodbandar rd. Traffic moves slovely. So plz slip &amp; don't worry.,107,6.5
"Sorry, I'll call later",19,10.5
Ok i msg u b4 i leave my house.,23,4.3
"Height of ""Oh shit....!!"" situation: A guy throws a luv letter on a gal but falls on her brothers head whos a gay,.;-):-D",99,16.2
"Solve d Case : A Man Was Found Murdered On  &lt;DECIMAL&gt; . &lt;#&gt;  AfterNoon. 1,His wife called Police. 2,Police questioned everyone. 3,Wife: Sir,I was sleeping, when the murder took place. 4.Cook: I was cooking. 5.Gardener: I was picking vegetables. 6.House-Maid: I went 2 d post office. 7.Children: We went 2 play. 8.Neighbour: We went 2 a marriage. Police arrested d murderer Immediately. Who's It? Reply With Reason, If U r Brilliant.",372,11.3
"Yup, no need. I'll jus wait 4 e rain 2 stop.",34,11.799999999999999
I only work from mon to thurs but Sat i cant leh... Booked liao... Which other day u free?,72,9.700000000000001
Someone U know has asked our dating service 2 contact you! Cant Guess who? CALL 09058091854 NOW all will be revealed. PO BOX385 M6 6WU,110,2.7
"Mum, hope you are having a great day. Hoping this text meets you well and full of life. Have a great day. Abiola",90,4.3999999999999995
Neshanth..tel me who r u?,21,14.299999999999999
When you came to hostel.,20,5.0
Yeah I'll try to scrounge something up,32,3.1
U horrible gal... U knew dat i was going out wif him yest n u still come n ask me...,65,9.2
GRAN ONLYFOUND OUT AFEW DAYS AGO.CUSOON HONI,38,2.6
My superior telling that friday is leave for all other department except ours:)so it will be leave for you:)any way call waheed fathima hr and conform it:),129,4.7
"Say this slowly.? GOD,I LOVE YOU &amp; I NEED YOU,CLEAN MY HEART WITH YOUR BLOOD.Send this to Ten special people &amp; u c miracle tomorrow, do it,pls,pls do it...",135,11.1
"Yep, at derek's house now, see you Sunday &lt;3",39,12.8
I can't make it tonight,19,5.3
Easy ah?sen got selected means its good..,35,8.6
Marvel Mobile Play the official Ultimate Spider-man game (£4.50) on ur mobile right now. Text SPIDER to 83338 for the game & we ll send u a FREE 8Ball wallpaper,131,4.6
I forgot 2 ask ü all smth.. There's a card on da present lei... How? Ü all want 2 write smth or sign on it?,83,9.6
 &lt;#&gt;  in mca. But not conform.,29,24.099999999999998
Ya even those cookies have jelly on them,33,0.0
"* Was really good to see you the other day dudette, been missing you!",56,5.4
"Remember all those whom i hurt during days of satanic imposter in me.need to pay a price,so be it.may destiny keep me going and as u said pray that i get the mind to get over the same.",147,2.7
Sent me ur email id soon,19,0.0
Ugh just got outta class,20,0.0
FreeMsg:Feelin kinda lnly hope u like 2 keep me company! Jst got a cam moby wanna c my pic?Txt or reply DATE to 82242 Msg150p 2rcv Hlp 08712317606 stop to 82242,130,2.3
Good morning princess! Happy New Year!,33,6.1
"Sorry, I'll call later  &lt;#&gt; mins",32,21.9
Did you see that film:),19,10.5
"I can make it up there, squeezed  &lt;#&gt;  bucks out of my dad",50,12.0
Talk sexy!! Make new friends or fall in love in the worlds most discreet text dating service. Just text VIP to 83110 and see who you could meet.,117,3.4000000000000004
 and  picking them up from various points,33,0.0
happened here while you were adventuring,35,0.0
"Sorry, I'll call later",19,10.5
I'm ok wif it cos i like 2 try new things. But i scared u dun like mah. Cos u said not too loud.,73,5.5
My darling sister. How are you doing. When's school resuming. Is there a minimum wait period before you reapply? Do take care,104,4.8
"Thanks for your Ringtone Order, Reference T91. You will be charged GBP 4 per week. You can unsubscribe at anytime by calling customer services on 09057039994",132,2.3
Same as kallis dismissial in 2nd test:-).,35,11.4
Happy New year my dear brother. I really do miss you. Just got your number and decided to send you this text wishing you only happiness. Abiola,117,2.6
"No, but you told me you were going, before you got drunk!",46,6.5
It's ok i noe u're busy but i'm really too bored so i msg u. I oso dunno wat colour she choose 4 me one.,80,6.2
Ugh its been a long day. I'm exhausted. Just want to cuddle up and take a nap,61,4.9
Or just do that 6times,18,0.0
PS U no ur a grown up now right?,24,4.2
I hate when she does this. She turns what should be a fun shopping trip into an annoying day of how everything would look in her house.,109,1.7999999999999998
No one interested. May be some business plan.,38,5.3
Pls help me tell Ashley that i cant find her number oh,43,0.0
"I'm taking derek &amp; taylor to walmart, if I'm not back by the time you're done just leave the mouse on my desk and I'll text you when priscilla's ready",125,6.4
"Not yet chikku..going to room nw, i'm in bus..",38,15.8
", ow u dey.i paid 60,400thousad.i told  u would call . ",43,11.600000000000001
Long after I quit. I get on only like 5 minutes a day as it is.,48,4.2
"SMS SERVICES. for your inclusive text credits, pls goto www.comuk.net login= ***** unsubscribe with STOP. no extra charge. help:08700469649. PO BOX420. IP4 5WE",137,10.9
... Are you in the pub?,18,22.2
"Good afternoon, my love ... How goes your day ? How did you sleep ? I hope your well, my boytoy ... I think of you ...",92,14.099999999999998
Your account has been refilled successfully by INR  &lt;DECIMAL&gt; . Your KeralaCircle prepaid account balance is Rs  &lt;DECIMAL&gt; . Your Transaction ID is KR &lt;#&gt; .,147,10.9
Yun buying... But school got offer 2000 plus only...,44,13.600000000000001
We tried to contact you re your reply to our offer of 750 mins 150 textand a new video phone call 08002988890 now or reply for free delivery tomorrow,121,0.0
Message:some text missing* Sender:Name Missing* *Number Missing *Sent:Date missing *Missing U a lot thats y everything is missing sent via fullonsms.com,132,6.800000000000001
You can never do NOTHING,20,0.0
"K, wait chikku..il send aftr  &lt;#&gt; mins",37,21.6
Hi kindly give us back our documents which we submitted for loan from STAPATI,64,0.0
Bored housewives! Chat n date now! 0871750.77.11! BT-national rate 10p/min only from landlines!,83,9.6
Hope you are not scared!,20,5.0
Please call our customer service representative on FREEPHONE 0808 145 4742 between 9am-11pm as you have WON a guaranteed £1000 cash or £5000 prize!,124,1.6
Dont gimme that lip caveboy,23,0.0
But that's on ebay it might be less elsewhere.,38,5.3
Yup ok thanx...,13,23.1
"I'm back, lemme know when you're ready",32,9.4
Sounds like something that someone testing me would sayy,48,0.0
"Come to me, slave. Your doing it again ... Going into your shell and unconsciously avoiding me ... You are making me unhappy :-(",105,10.5
Xy trying smth now. U eat already? We havent...,39,12.8
Ok lor. Anyway i thk we cant get tickets now cos like quite late already. U wan 2 go look 4 ur frens a not? Darren is wif them now...,104,5.800000000000001
hi baby im sat on the bloody bus at the mo and i wont be home until about 7:30 wanna do somethin later? call me later ortxt back jess xx,107,1.9
Yes i have. So that's why u texted. Pshew...missing you so much,52,11.5
Also are you bringing galileo or dobby,32,0.0
As per your request 'Maangalyam (Alaipayuthe)' has been set as your callertune for all Callers. Press *9 to copy your friends Callertune,115,5.2
Double your mins & txts on Orange or 1/2 price linerental - Motorola and SonyEricsson with B/Tooth FREE-Nokia FREE Call MobileUpd8 on 08000839402 or2optout/HV9D,137,4.3999999999999995
Is there any training tomorrow?,27,3.6999999999999997
"Hi hope u get this txt~journey hasnt been gd,now about 50 mins late I think.",62,4.8
Don't forget who owns you and who's private property you are ... And be my good boy always .. *passionate kiss*,91,9.9
Nope. I just forgot. Will show next week,33,6.1
K:)eng rocking in ashes:),22,18.2
